{
    "$schema": "https://packages.couchbase.com/couchbase-lite/testserver.schema.json",
    "sync-gateways": [{"hostname": "localhost", "tls": true}],
    "couchbase-servers": [{"hostname": "localhost"}],
    "greenboard": {"hostname": "10.100.150.106", "username": "writer", "password": "couchbase2" },
    "api-version": 1
}
